ConID,DialogList,LinkedChoiceID,TextType
Con_73,"갑자기 정면에서 인형이 나타나 당신을 덮칩니다.

오른쪽 거울에만 당신의 모습이 비치고 있습니다.

왼쪽과 지나온 길에는 거울이 없을 것 같습니다.","Cho_78,Cho_79,Cho_80",
Con_74,"당신은 정면의 거울에서 인형이 달려드는 모습을 목격합니다.

왼쪽에는 거울에 비친 당신의 모습이 보이며 그 반대 방향은 비어 있습니다.","Cho_75,Cho_76,Cho_77",
Con_75,"갑자기 앞에서 인형이 나타나 당신에게 달려듭니다.

한쪽 길이 뚫려 있고 오른쪽은 거울이 막고 있습니다.","Cho_78,Cho_79,Cho_80",
Con_76,"당신은 정면의 거울에서 인형이 달려드는 모습을 목격합니다.

왼쪽에는 거울에 비친 당신의 모습이 보입니다.

오른쪽에는 아무것도 비치지 않으니 아마 비어 있을 것 같습니다.","Cho_75,Cho_76,Cho_77",
Con_77,"정면에서 인형이 나타나 당신을 덮칩니다.

오른쪽 거울에만 당신의 모습이 비치고 있습니다.

왼쪽과 지나온 길에는 거울이 없을 겁니다.","Cho_78,Cho_79,Cho_80",
Con_78,"당신은 정면의 거울에서 인형이 달려드는 모습을 목격합니다.

왼쪽에는 거울에 비친 당신의 모습이 보이며 그 반대 방향은 비어 있습니다.","Cho_75,Cho_76,Cho_77",
Con_79,"앞에서 인형이 나타나 당신에게 달려듭니다.

한쪽 길이 뚫려 있고 오른쪽에는 거울이 있습니다.","Cho_78,Cho_79,Cho_80",
Con_80,"당신은 정면의 거울에서 인형이 달려드는 모습을 목격합니다.

왼쪽에는 거울에 비친 당신의 모습이 보입니다.

그렇다면 반대쪽 길은 아마 비어 있을 것입니다.","Cho_75,Cho_76,Cho_77",
Con_81,"갑자기 앞에서 인형이 나타나 당신에게 달려듭니다.

다른쪽 길에는 거울이 없겠지만 오른쪽 길에는 거울이 있습니다.","Cho_78,Cho_79,Cho_80",
Con_82,"거울 정면에서 인형이 당신을 덮칩니다.

왼쪽에는 거울에 비친 당신의 모습이 보입니다.

왼쪽 거울에 비친 당신의 모습 뒤쪽으로 길이 보이는 것 같습니다.","Cho_75,Cho_76,Cho_77",
Con_83,"앞에서 인형이 나타나 당신에게 달려듭니다.

상이 비치지 않는 쪽에는 거울이 없겠지만 반대편 오른쪽 길에는 거울이 있습니다.","Cho_78,Cho_79,Cho_80",
Con_84,"당신은 가만히 서서 인형을 응시합니다.

인형은 아직 당신의 의도를 알아차리지 못한 것 같습니다. ","Cho_81,Cho_82,Cho_83",
Con_85,"당신은 인형을 향해 빠르게 달려 몸을 던집니다.

당신과 부딪힌 인형은 크게 밀려나며 나동그라집니다.

인형은 속에 아무것도 없는 것처럼 가벼웠습니다.

곧이어 다시 일어난 인형이 기괴한 소리를 내며 당신에게 다가오기 시작합니다.",,
Con_86,"당신은 다가오는 인형에게 거세게 저항합니다.

하지만 인형은 머리가 돌아간 상태임에도 아랑곳하지 않고 접근하여 끝내 당신을 붙잡습니다.",Cho_87,
Con_87,"당신이 향한 곳은 거울로 된 벽이었습니다.

마지막 순간에 거울을 겨우 눈치챈 당신은 속도를 줄여 충돌을 피합니다.

하지만 빈틈을 놓치지 않은 인형이 당신을 붙잡습니다.",Cho_88,
Con_88,"""멍!"" 강아지는 당신의 명령을 듣고 돌진하여 인형의 다리를 물고 늘어집니다.

인형은 미동도 하지 않습니다.

“으르르…” 별 효과가 없자 이번엔 강아지가 다른 쪽 다리를 물고 흔들기 시작합니다.

 부동자세로서 있던 인형은 강아지의 공격에 점점 균형을 잃고 뒤뚱거리다가 그대로 쓰러집니다.",Cho_84,
Con_89,"인형은 부위 별로 분리되어 바닥에 흩어졌지만 강아지는 계속해서 인형의 발을 씹으며 장난칩니다. 

모두가 섣불리 입을 떼지 못하고 이 광경을 바라보기만 합니다.

머리가 지끈거립니다.",Cho_85,
Con_90,"“♬~ 안내데스크에서 알려드립니다.""

그때 방송을 알리는 소리가 들려옵니다.

""만 7세의 OOO님, OOO님을 찾고 계시는 보호자 분이 있으시다면 저희 놀이공원에서 OOO님을 보호하고 있사오니 놀이공원 입구 매표소에 위치한 안내 데스크로 와주시기 바랍니다. 다시 한 번 알려드립니다…”",Cho_86,
Con_91,"놀이공원이 하루를 마감하려는 저녁 시간, 안내 데스크에는 흐린 불빛이 켜져 있습니다.

데스크 뒤에는 안내원이 주위를 두리번거리며 확인하고 있습니다.

그때, 미로의 입구에서 헐떡이며 달려오는 누군가가 보입니다.

""방송, 방송을 들었어요. 이제 8살에, 그러니까 만7세에요. 그리고 웃을 때 얼굴에 보조개가 있고...""

그녀의 목소리는 떨리고 있습니다.

""보호자분, 진정하세요. 저희 쪽에서 보호 중입니다. 아이분 이름이 OOO님 맞으시죠?""

안내원은 차분히 대답하며 데스크 안쪽의 사무실 문을 바라봅니다.

그 순간, 사무실의 문이 열리고 아이가 나타납니다.

""엄마아!""

""아이야!""

어머니의 얼굴에 그제서야 안도의 표정이 피어오릅니다.

그녀는 빠르게 사무실로 달려가 아이를 안아올립니다.",Cho_89,
